{
  "schema_id": "diiac:policy-drift-report",
  "schema_version": "1.0.0",
  "timestamp": "2026-02-10T13:35:52.865Z",
  "binding_id": "331618126710c3268f0a4b6444c35c332f4843562dadbbe67ccd2f2debe53732",
  "policy_id": "CTO_STRATEGY_BASELINE",
  "drift_status": "HASH_DRIFT",
  "details": {
    "bound": "6b4aeb2f00000000000000000000000000000000000000000000000000000000",
    "current": "502748882339e43cca952484adcfe4b50d9e217e59fe0a20d7b56d23f124765d"
  }
}